title,text,author,score,upvote_ratio,num_comments,created_utc,url,post_url,flair,is_self
Weekly Earnings Thread 11/3 - 11/7,,OSRSkarma,255,0.98,1749,2025-10-31 13:51:54,https://www.reddit.com/r/wallstreetbets/comments/1okv6l7/weekly_earnings_thread_113_117/,https://i.redd.it/om9eeumxcgyf1.jpeg,Earnings Thread,False
"What Are Your Moves Tomorrow, November 05, 2025",This post contains content not supported on old Reddit. [Click here to view the full post](https://sh.reddit.com/r/wallstreetbets/comments/1ooj3hj),wsbapp,88,0.94,1553,2025-11-04 20:57:33,https://www.reddit.com/r/wallstreetbets/comments/1ooj3hj/what_are_your_moves_tomorrow_november_05_2025/,https://www.reddit.com/r/wallstreetbets/comments/1ooj3hj/what_are_your_moves_tomorrow_november_05_2025/,Daily Discussion,True
We do like a good narrative,,blalah,3754,0.97,71,2025-11-04 17:51:55,https://www.reddit.com/r/wallstreetbets/comments/1ooe24l/we_do_like_a_good_narrative/,https://i.redd.it/3jgw8e7y2azf1.jpeg,Meme,False
700k put option MSTR bet.,"I’ve finally decided to embrace being a gay bear. 700k put option against MSTR. Betting bitcoin will go below 100k. If it doesn’t, I’m wrecked for life. ",CarefulAd4757,345,0.95,87,2025-11-04 19:55:19,https://www.reddit.com/r/wallstreetbets/comments/1oohgjz/700k_put_option_mstr_bet/,https://i.redd.it/e7d3ozvepazf1.jpeg,Discussion,False
Michael Burry is going all in on shorting the bubble,"
Michael Burry goes short on $PLTR and $NVDA in his latest 13F filing.

Scion Capital just bought put options on 1M Nvidia shares and 5M Palantir shares.

Pure bubble shorting, he's going after the next 2008.

",Quixotus,7271,0.97,1066,2025-11-04 00:24:58,https://www.reddit.com/r/wallstreetbets/comments/1ont093/michael_burry_is_going_all_in_on_shorting_the/,https://i.redd.it/ltf3c12mw4zf1.jpeg,Shitpost,False
"Yum Brands to review strategic options for Pizza Hut, opening the door to a sale",,ThatUnoriginalGuy,515,0.98,198,2025-11-04 13:47:20,https://www.reddit.com/r/wallstreetbets/comments/1oo7k5j/yum_brands_to_review_strategic_options_for_pizza/,https://www.cnbc.com/2025/11/04/yum-brands-pizza-hut-strategic-options-sale.html,Discussion,False
I’m addicted to losing money,I kept trying to play the short game and got burned every time. ,Budy71,200,0.98,53,2025-11-04 18:53:34,https://www.reddit.com/r/wallstreetbets/comments/1oofs8x/im_addicted_to_losing_money/,https://i.redd.it/oklm74heeazf1.jpeg,Loss,False
Zero Fs Given,Went from up 100% to down 50. And honestly? Dont care. Letting it all crash. Lost my job. Relationship down the drain. At this point? I just dont care anymore.,Tallpaul1989,137,0.9,138,2025-11-04 20:08:11,https://www.reddit.com/r/wallstreetbets/comments/1oohtdd/zero_fs_given/,https://i.redd.it/7tyabjoprazf1.jpeg,Loss,False
Shopify drops 5% pre-market after Q3 operating income slightly misses ($434M vs $437M est) despite 32% revenue jump to $2.84B and strong GMV,"No paywall: [https://www.investors.com/news/technology/shopify-stock-shop-shopify-earnings-news-q3-2025/](https://www.investors.com/news/technology/shopify-stock-shop-shopify-earnings-news-q3-2025/)

&gt;**Shopify** (SHOP) stock fell after the e-commerce platform provider reported third-quarter operating income that missed estimates while revenue beat. The company's December quarter sales outlook met expectations amid its expansion into enterprise and international markets.

&gt;The e-commerce software maker reported Shopify earnings before the market open. Excluding equity investments, operating income rose 53% to $434 million versus estimates of $437 million, according to FactSet.

&gt;Also, revenue climbed 32% to $2.844 billion. Shopify stock analysts polled by FactSet predicted revenue of $2.757 billion.",callsonreddit,391,0.98,62,2025-11-04 13:32:10,https://www.reddit.com/r/wallstreetbets/comments/1oo772n/shopify_drops_5_premarket_after_q3_operating/,https://www.reddit.com/r/wallstreetbets/comments/1oo772n/shopify_drops_5_premarket_after_q3_operating/,News,True
It’s okay guys,,Clubpenguin8888,114,0.98,10,2025-11-04 21:25:29,https://www.reddit.com/r/wallstreetbets/comments/1oojs66/its_okay_guys/,https://i.redd.it/v82gnb4i5bzf1.jpeg,Meme,False
So I lost the earnings gamble,"https://preview.redd.it/rpt1xbtj59zf1.png?width=957&amp;format=png&amp;auto=webp&amp;s=aab93d8b136c19fd64791eb8a6479709ea754904

I mean I was doing good last week, up 4k off of Amazon and Google but then I put my eggs in the wrong basket. Im still confident in Pintrest carrying me out of the red and market corrections bringing me a little closer to even on Palantir and Uber, gonna hold those 3 calls for 20ish days and see how they are..... (Around 1.3k in margins if anyone is curious)

UPDATE:  
I lost :/",GSSnamesniped,186,0.9,123,2025-11-04 14:44:21,https://www.reddit.com/r/wallstreetbets/comments/1oo8zgv/so_i_lost_the_earnings_gamble/,https://www.reddit.com/r/wallstreetbets/comments/1oo8zgv/so_i_lost_the_earnings_gamble/,Loss,True
"Daily Discussion Thread for November 4, 2025",This post contains content not supported on old Reddit. [Click here to view the full post](https://sh.reddit.com/r/wallstreetbets/comments/1oo61ok),wsbapp,252,0.94,12810,2025-11-04 12:42:50,https://www.reddit.com/r/wallstreetbets/comments/1oo61ok/daily_discussion_thread_for_november_4_2025/,https://www.reddit.com/r/wallstreetbets/comments/1oo61ok/daily_discussion_thread_for_november_4_2025/,Daily Discussion,True
Full Ported on QQQ Put Spread,"After yesterday’s AMZN Open AI bullshit deal and market took off another 1% off AI circle jerking, I decided I wanted to aggressively finance a bear put spread. 

Made the short leg a little too close, but will roll it out at market open to give more room for QQQ to drop (which it will)

Woke up to premarket intrinsic value gainz ",sarhama072,263,0.96,70,2025-11-04 11:43:26,https://www.reddit.com/r/wallstreetbets/comments/1oo58i8/full_ported_on_qqq_put_spread/,https://www.reddit.com/gallery/1oo58i8,Gain,False
"AMD beats Q3 estimates on top and bottom line, offers strong Q4 guidance",,Force_Hammer,69,1.0,32,2025-11-04 21:24:38,https://www.reddit.com/r/wallstreetbets/comments/1oojrdm/amd_beats_q3_estimates_on_top_and_bottom_line/,https://finance.yahoo.com/news/amd-beats-q3-estimates-on-top-and-bottom-line-offers-strong-q4-guidance-202400302.html,News,False
It’s Joever,Goodbye folks! Gonna stick to holding bags of rocks in my Roth IRA. Down 22k in taxable and up 20k in Roth. Broke even after 2 years of clicking buttons. Time to become a loser boglehead. Good luck to everyone,Bulky_Lunch2771,46,0.96,17,2025-11-04 21:04:22,https://www.reddit.com/r/wallstreetbets/comments/1ooja8r/its_joever/,https://i.redd.it/fxzeenjq1bzf1.jpeg,Loss,False
100k YOLO Pltr short,,tweakggamer,67,0.86,55,2025-11-04 18:29:48,https://www.reddit.com/r/wallstreetbets/comments/1oof4g4/100k_yolo_pltr_short/,https://i.redd.it/ecare7q5aazf1.jpeg,YOLO,False
Losses are part of the game 🙏,"There's always another quarterly bonus, right? ",ogami_itto,28,0.94,12,2025-11-04 20:46:28,https://www.reddit.com/r/wallstreetbets/comments/1ooit22/losses_are_part_of_the_game/,https://i.redd.it/y2qea4kjyazf1.png,Loss,False
FRODO BAG(HOLD)INS - PLTR 3DTE SHORT YOLOOO,"Predicting 180 end of week, people quaking in their boots over overvaluation, profit taking, the great Michael Burry (Gandalf) Short, and the fact that they’re lowkey EVIL. You’re welcome for the degen diligence everybody - feel free to join me. ",sl3azebag,49,0.92,9,2025-11-04 16:31:30,https://www.reddit.com/r/wallstreetbets/comments/1oobuhv/frodo_bagholdins_pltr_3dte_short_yolooo/,https://i.redd.it/4n80rdv1p9zf1.jpeg,YOLO,False
Gains man,"Fighter of the mod ban (ah ah ahh)
Champion of Jensen
Master of karate
And tendies for everyone ",HighlightFeeling4118,63,0.82,26,2025-11-04 15:15:32,https://www.reddit.com/r/wallstreetbets/comments/1oo9slp/gains_man/,https://www.reddit.com/gallery/1oo9slp,Gain,False
$300k $TOST ER play,"Everyone is watching the clock. $TOST ER is TOMORROW.

People think this is a cash register company. This isn't a POS. It's the ENTIRE RESTAURANT OPERATING SYSTEM.

They don't just sell a terminal. They sell the whole stack. They have the Toast Go handhelds so servers never leave the floor. They have the Kitchen Display Systems (KDS) that talk to the handhelds. They have Payroll. They have Inventory. They have Marketing and Loyalty programs. They even have Toast Capital to give these places loans. It's a full-stack, closed-loop ecosystem. You buy one piece, you end up buying it all.

And what's the competition? That trash Clover ($FI)? Or that joke $SQ (Square)? Ahahahahaha. Clover is a stupid terminal that Fiserv forces on banks. $SQ is still a toy for farmers markets and coffee shops. Neither of them can run a REAL kitchen. Toast is a weapon built for restaurants. No contest. Oh yes oh yes.

And they're not just selling to your local pizzeria anymore. That's Vertical 1. They are moving upmarket. They are signing ENTERPRISE deals. QSR chains. HOTELS. STADIUMS. They are eating everyone's lunch. They own the small guys and now they're taking the big guys. 

And this entire platform? They're shipping it GLOBAL. Canada. UK. Ireland. Australia. It's scaling FASTER than the US did. This isn't just a US story anymore. That market is already locked up. They're in 148,000+ locations and just getting started.

And just today they just signed a GLOBAL deal with Uber. $UBER. UBER TOST 

The suits on Wall Street with their ""$40 base case"" are looking at one product in one country.

Bull Case: $55 by Friday / $120 by Dec 2026",wutang,52,0.91,60,2025-11-04 15:24:58,https://www.reddit.com/r/wallstreetbets/comments/1ooa1m8/300k_tost_er_play/,https://i.redd.it/0g1s1yj6d9zf1.jpeg,YOLO,False
Lawrd have mercy,,Darkraskel90,17,0.9,17,2025-11-04 21:20:40,https://www.reddit.com/r/wallstreetbets/comments/1oojne6/lawrd_have_mercy/,https://i.redd.it/xnfsa89n4bzf1.jpeg,Loss,False
Palantir Q4 outlook beats Wall Street estimates despite US government shutdown worries,,toydan,1282,0.95,162,2025-11-03 21:09:40,https://www.reddit.com/r/wallstreetbets/comments/1ono4cq/palantir_q4_outlook_beats_wall_street_estimates/,https://finance.yahoo.com/news/palantir-q4-outlook-beats-wall-street-estimates-despite-us-government-shutdown-worries-182343901.html,News,False
MSTY and ULTY ate all my gains from this year :-/,,That_anonymous_guy18,17,0.95,11,2025-11-04 20:14:36,https://www.reddit.com/r/wallstreetbets/comments/1oohzn4/msty_and_ulty_ate_all_my_gains_from_this_year/,https://i.redd.it/97ai21xusazf1.jpeg,Loss,False
It was fun gang,"I can vaguely remember the energy and excitement during those first weeks of the memestonck rally. Treys trade, that duck guy, whoever and whatever was evangelizing the “in it together 
“ to fight against the corruption of the market makers, I was drinking all that koolaid. 

While I don’t doubt there has been some nonsensical fuckery, I’ve reached a point where I just don’t have the energy just Hodling when I’m down so much. 

Many of the young folk here will say I shoulda DCA’d but if you saw the hundreds of buys I had during that first year, you’d understand that at a certain point enough is enough. 

Anyways, I wish all of you the very best but I have officially sold AMC. Cheers to a better year ahead! 

Disclosure: just sold some other AI rallied stocks to put myself in a neutral capital gain position for 2024 🙏",Hypnotique007,1263,0.95,359,2025-11-03 20:52:25,https://www.reddit.com/r/wallstreetbets/comments/1onnnab/it_was_fun_gang/,https://www.reddit.com/gallery/1onnnab,Loss,False
GLOO IPO,"Robinhood is offering IPO access to Gloo: ""Gloo is a leading technology platform for the faith and flourishing ecosystem, providing values-based AI, resources, insights and funding. Gloo serves over 140,000 faith, ministry and nonprofit leaders and is based in Boulder, Colorado.""

Guys, this IPO is going to be huge, one way or another. Gloo combines Jesus and AI. Nothing else needs to be said.

Do I reverse mortgage my house and buy calls, or do I rob the hobo who lives behind the Wendys down the street and use his meth-money to buy puts?

This IPO seriously has me questioning my faith. Please offer some advice. I know at least some of you have not fallen to such levels of degeneracy that you can't personally speak to Jesus and tell me what to do here.

[The Baptism of AI \(Verrocchio and Leonardo da Vinci\)](https://preview.redd.it/3yklrgdn85zf1.png?width=760&amp;format=png&amp;auto=webp&amp;s=929a7098c71aef94f56de1bddf2aa52d2216da35)",4Yk9gop,514,0.9,228,2025-11-04 01:33:47,https://www.reddit.com/r/wallstreetbets/comments/1onujja/gloo_ipo/,https://www.reddit.com/r/wallstreetbets/comments/1onujja/gloo_ipo/,Discussion,True
